{
  "schema_version": "1.0.0",
  "status": "GOLD_QUERY_REWRITE_PROPOSALS_READY_HUMAN_REVIEW_PENDING",
  "source_dataset": {
    "path": "ai/evaluation/datasets/gold/rag_gold_v1.jsonl",
    "sha256": "9B52AF026B7C8F21AC4D59ECD4D0F2E1A528E78448225EBE1F5E542A71A8E54A",
    "record_count": 60
  },
  "summary": {
    "proposal_count": 60,
    "automatic_gold_update": false,
    "human_review_status": "PENDING",
    "label_revalidation_required": true
  },
  "proposals": [
    {
      "case_id": "RAGV2-GOLD-0001",
      "source_query_variant_type": "DIRECT",
      "proposed_query": "정수기에서 물이 안 나와요. 빨리 고쳐주세요.",
      "rewrite_class": "NATURALIZED",
      "intent_change": true,
      "review_note": "1차 검수자가 확정한 긴급 수리 요청형 사용자 발화다. 무출수 의도는 유지하되 상담·수리 전환 라벨을 다시 검수해야 한다."
    },
    {
      "case_id": "RAGV2-GOLD-0002",
      "source_query_variant_type": "DIRECT",
      "proposed_query": "냉수가 미지근해요. 해결 방법 알려주세요.",
      "rewrite_class": "INTENT_CLARIFIED",
      "intent_change": true,
      "review_note": "1차 검수자가 일반적인 해결 방법 요청으로 확정했다. 기존 대기 시간·상담 조건 라벨은 다시 검수해야 한다."
    },
    {
      "case_id": "RAGV2-GOLD-0003",
      "source_query_variant_type": "DIRECT",
      "proposed_query": "정수기에서 평소와 다른 소리가 나는데 고장 아닌가요?",
      "rewrite_class": "NATURALIZED",
      "intent_change": false,
      "review_note": "1차 검수자가 확정한 고장 여부 확인형 문의다. 정상 작동음과 과도한 소음을 구분하려는 의도는 유지한다."
    },
    {
      "case_id": "RAGV2-GOLD-0004",
      "source_query_variant_type": "DIRECT",
      "proposed_query": "정수기 밑에서 물이 새는 것 같아요. 지금 어떻게 해야 하나요?",
      "rewrite_class": "NATURALIZED",
      "intent_change": false,
      "review_note": "안전 조치를 질문 안에서 미리 제시하지 않도록 수정했다."
    },
    {
      "case_id": "RAGV2-GOLD-0005",
      "source_query_variant_type": "DIRECT",
      "proposed_query": "정수기 물에서 이상한 맛과 냄새가 나요. 이거 문제있는거 아닌가요?",
      "rewrite_class": "NATURALIZED",
      "intent_change": false,
      "review_note": "1차 검수자가 확정한 문제 여부 확인형 문의다. 맛·냄새 이상 의도는 유지하며 DIRECT와 COLLOQUIAL 중 변형 유형을 다시 검수해야 한다."
    },
    {
      "case_id": "RAGV2-GOLD-0006",
      "source_query_variant_type": "DIRECT",
      "proposed_query": "일주일 전부터 정수기 물이 예전보다 잘 안 나와요. 해결 방법 알려주세요!",
      "rewrite_class": "NATURALIZED",
      "intent_change": false,
      "review_note": "1차 검수자가 확정한 비교형 저유량 문의다. 예전보다라는 표현으로 완전 무출수와 구분한다."
    },
    {
      "case_id": "RAGV2-GOLD-0007",
      "source_query_variant_type": "DIRECT",
      "proposed_query": "온수를 받는데 김이 나고 물이 튀어요",
      "rewrite_class": "INTENT_CLARIFIED",
      "intent_change": true,
      "review_note": "1차 검수자가 확정한 관찰형 문의다. 해결 요청을 명시하지 않았고 추상적인 화상 위험을 김과 물 튐 증상으로 바꿨으므로 근거와 안내 정책을 다시 검수해야 한다."
    },
    {
      "case_id": "RAGV2-GOLD-0008",
      "source_query_variant_type": "DIRECT",
      "proposed_query": "정수기에서 물이 안 나와요. 어떻게 해야 하나요?",
      "rewrite_class": "NATURALIZED",
      "intent_change": false,
      "review_note": "짧은 무출수 문의를 자연스러운 질문으로 완성했다."
    },
    {
      "case_id": "RAGV2-GOLD-0009",
      "source_query_variant_type": "DIRECT",
      "proposed_query": "냉수가 시원하지 않고 미지근해요. 어디를 확인해야 하나요?",
      "rewrite_class": "NATURALIZED",
      "intent_change": false,
      "review_note": "냉수 온도 문제 의도를 유지했다."
    },
    {
      "case_id": "RAGV2-GOLD-0010",
      "source_query_variant_type": "DIRECT",
      "proposed_query": "정수기에서 소리가 나는데 정상인가요?",
      "rewrite_class": "NATURALIZED",
      "intent_change": false,
      "review_note": "어색한 종결 표현을 실제 문의 형태로 수정했다."
    },
    {
      "case_id": "RAGV2-GOLD-0011",
      "source_query_variant_type": "DIRECT",
      "proposed_query": "정수기 밑에 물이 흥건해요. 누수가 의심됩니다.",
      "rewrite_class": "NATURALIZED",
      "intent_change": false,
      "review_note": "1차 검수자가 확정한 관찰형 문의다. 정수기 밑에 고인 물을 근거로 누수를 의심하며 조치 요청은 명시하지 않았다."
    },
    {
      "case_id": "RAGV2-GOLD-0012",
      "source_query_variant_type": "DIRECT",
      "proposed_query": "물맛이나 냄새가 이상한데 무엇부터 확인하면 될까요?",
      "rewrite_class": "NATURALIZED",
      "intent_change": false,
      "review_note": "기존 의도를 유지하면서 간결하게 정리했다."
    },
    {
      "case_id": "RAGV2-GOLD-0013",
      "source_query_variant_type": "DIRECT",
      "proposed_query": "차가운 물이 너무 쫄쫄 나와요. 제품에 문제있는거 아닌가요?",
      "rewrite_class": "NATURALIZED",
      "intent_change": true,
      "review_note": "1차 검수자가 확정한 구어체 문의다. 냉수 저유량의 점검 방법 요청을 제품 이상 여부 확인으로 바꿨으므로 근거·안내 정책과 query_variant_type을 다시 검수해야 한다."
    },
    {
      "case_id": "RAGV2-GOLD-0014",
      "source_query_variant_type": "DIRECT",
      "proposed_query": "온수를 받을 때 뜨거운 물이나 김이 튀는데 계속 사용해도 괜찮을까요?",
      "rewrite_class": "INTENT_CLARIFIED",
      "intent_change": true,
      "review_note": "주의사항 일반 질문을 실제 스팀 분사 상황으로 구체화했으므로 안내 정책을 재검수해야 한다."
    },
    {
      "case_id": "RAGV2-GOLD-0015",
      "source_query_variant_type": "DIRECT",
      "proposed_query": "필터를 교체했는데도 물이 안 나와요. 어떻게 해야 하나요?",
      "rewrite_class": "INTENT_CLARIFIED",
      "intent_change": true,
      "review_note": "매뉴얼의 상담 전환 조건인 필터 교체 후 무출수로 명확히 맞췄다."
    },
    {
      "case_id": "RAGV2-GOLD-0016",
      "source_query_variant_type": "DIRECT",
      "proposed_query": "전원은 들어오는데 두 시간이 지나도 냉수가 차갑지 않아요. 어떻게 해야 하나요?",
      "rewrite_class": "NATURALIZED",
      "intent_change": false,
      "review_note": "상담 전환 조건을 유지했으며 안내 정책 재검수가 필요하다."
    },
    {
      "case_id": "RAGV2-GOLD-0017",
      "source_query_variant_type": "DIRECT",
      "proposed_query": "방열팬 쪽에서 너무 큰 소리가 나요. 고장일까요?",
      "rewrite_class": "NATURALIZED",
      "intent_change": false,
      "review_note": "과도한 소음의 상담 전환 조건을 유지했으며 안내 정책 재검수가 필요하다."
    },
    {
      "case_id": "RAGV2-GOLD-0018",
      "source_query_variant_type": "DIRECT",
      "proposed_query": "정수기 안쪽에서 물이 흘러나와요. 빠른 조치법을 알려주세요.",
      "rewrite_class": "ANSWER_LEAKAGE_REMOVED",
      "intent_change": false,
      "review_note": "1차 검수자가 확정한 긴급 조치 요청이다. 원수 밸브와 전원이라는 예상 조치를 질문에서 제거하고 빠른 조치 방법을 요청하도록 바꿨다."
    },
    {
      "case_id": "RAGV2-GOLD-0019",
      "source_query_variant_type": "DIRECT",
      "proposed_query": "오랜만에 정수기를 사용했는데 물에서 비린 맛과 냄새가 나요. 어떻게 해야 하나요?",
      "rewrite_class": "INTENT_CLARIFIED",
      "intent_change": true,
      "review_note": "P038의 장기 부재 원인과 질문 조건을 맞췄다."
    },
    {
      "case_id": "RAGV2-GOLD-0020",
      "source_query_variant_type": "DIRECT",
      "proposed_query": "안내받은 대로 정수기 아래쪽 밸브를 확인했는데 열려 있어요. 그런데도 물이 잘 안 나와요.",
      "rewrite_class": "NATURALIZED",
      "intent_change": false,
      "review_note": "1차 검수자가 확정한 후속 문의다. 원수 밸브라는 전문 용어를 피하면서 밸브가 열려 있는데도 출수량이 적다는 진단 조건을 유지했다."
    },
    {
      "case_id": "RAGV2-GOLD-0021",
      "source_query_variant_type": "COLLOQUIAL",
      "proposed_query": "정수기 밑이 계속 축축해져요. 어디서 물이 새는지 모르겠어요.",
      "rewrite_class": "NATURALIZED",
      "intent_change": false,
      "review_note": "1차 검수자가 확정한 구어체 누수 문의다. 반복적으로 바닥이 젖지만 누수 위치를 모르는 상황으로 RAGV2-GOLD-0004와 구분했다."
    },
    {
      "case_id": "RAGV2-GOLD-0022",
      "source_query_variant_type": "COLLOQUIAL",
      "proposed_query": "냉수가 계속 미지근한데 이유가 뭔가요?",
      "rewrite_class": "NATURALIZED",
      "intent_change": false,
      "review_note": "1차 검수자가 확정한 구어체 원인 문의다. 중복 표현을 줄이면서 지속적인 냉수 온도 이상 의도를 유지했다."
    },
    {
      "case_id": "RAGV2-GOLD-0023",
      "source_query_variant_type": "COLLOQUIAL",
      "proposed_query": "정수기 물이 갑자기 졸졸 나와요. 어디를 확인해야 하나요?",
      "rewrite_class": "NATURALIZED",
      "intent_change": false,
      "review_note": "1차 검수자가 확정한 구어체 저유량 문의다. 물줄기 대신 정수기 물로 바꾸면서 갑작스러운 저유량과 점검 요청 의도를 유지했다."
    },
    {
      "case_id": "RAGV2-GOLD-0024",
      "source_query_variant_type": "COLLOQUIAL",
      "proposed_query": "물에서 비린내 같은 게 나는데 먹어도 되는건가요?",
      "rewrite_class": "NATURALIZED",
      "intent_change": true,
      "review_note": "1차 검수자가 확정한 구어체 섭취 안전성 문의다. 일반 조치 요청을 비린내가 나는 물을 먹어도 되는지 묻는 질문으로 바꿨으므로 위험도와 안내 정책을 다시 검수해야 한다."
    },
    {
      "case_id": "RAGV2-GOLD-0025",
      "source_query_variant_type": "COLLOQUIAL",
      "proposed_query": "버튼을 눌러도 물이 한 방울도 안 나와요. 뭘 확인해야 하나요?",
      "rewrite_class": "NATURALIZED",
      "intent_change": false,
      "review_note": "구어체 무출수 문의를 유지했다."
    },
    {
      "case_id": "RAGV2-GOLD-0026",
      "source_query_variant_type": "COLLOQUIAL",
      "proposed_query": "정수기가 윙윙거리는데 고장 난 건가요?",
      "rewrite_class": "NATURALIZED",
      "intent_change": false,
      "review_note": "이미 자연스러운 구어체를 유지했다."
    },
    {
      "case_id": "RAGV2-GOLD-0027",
      "source_query_variant_type": "COLLOQUIAL",
      "proposed_query": "정수기 아래 바닥에 물이 흥건해졌어요. 뭘 먼저 해야 하죠?",
      "rewrite_class": "NATURALIZED",
      "intent_change": false,
      "review_note": "누수 대상을 명확히 하고 구어체를 유지했다."
    },
    {
      "case_id": "RAGV2-GOLD-0028",
      "source_query_variant_type": "COLLOQUIAL",
      "proposed_query": "예전보다 물 나오는 힘이 확 약해졌어요. 어떻게 조치해 주실 건가요?",
      "rewrite_class": "NATURALIZED",
      "intent_change": true,
      "review_note": "1차 검수자가 확정한 서비스 조치 요청이다. 저유량 자가 점검 질문을 상담 주체의 조치를 요구하는 문의로 바꿨으므로 안내 정책을 다시 검수해야 한다."
    },
    {
      "case_id": "RAGV2-GOLD-0029",
      "source_query_variant_type": "COLLOQUIAL",
      "proposed_query": "온수를 받을 때 김이 나고 물이 튀어서 무서워요. 계속 써도 되나요?",
      "rewrite_class": "INTENT_CLARIFIED",
      "intent_change": true,
      "review_note": "1차 검수자가 확정한 구어체 안전성 문의다. 막연한 우려를 실제 김과 물 튐 상황 및 계속 사용 가능 여부 질문으로 구체화했다."
    },
    {
      "case_id": "RAGV2-GOLD-0030",
      "source_query_variant_type": "COLLOQUIAL",
      "proposed_query": "찬물 버튼을 눌렀는데 그냥 미지근한 물이 나와요. 왜 그런가요?",
      "rewrite_class": "NATURALIZED",
      "intent_change": false,
      "review_note": "1차 검수자가 확정한 구어체 냉수 온도 문의다. 찬물 버튼을 선택했지만 미지근한 물이 나온다는 조건과 원인 질문을 명확히 했다."
    },
    {
      "case_id": "RAGV2-GOLD-0031",
      "source_query_variant_type": "TYPO_ABBREVIATION",
      "proposed_query": "정수기 물이 안 나와여 어떡게 해요?",
      "rewrite_class": "TYPO_VARIANT_PRESERVED",
      "intent_change": false,
      "review_note": "1차 검수자가 확정한 채팅형 오타 문의다. 나와여와 어떡게를 의도적으로 보존하면서 무출수 해결 요청을 유지했다."
    },
    {
      "case_id": "RAGV2-GOLD-0032",
      "source_query_variant_type": "TYPO_ABBREVIATION",